{
  "note": "Tuning constants for elections, coalitions, interest groups, unrest and laws. Every value has a default in src/content/schemas/rules.ts; list only what you want to change. These are gameplay estimates, not real-world facts.",
  "elections": {},
  "coalitions": {},
  "interest_groups": {},
  "unrest": {},
  "laws": {}
}
